candidate_id,years_experience,education_level,skills,experience_description,position_applied,suitable
CAND_0316,16,phd,"javascript, nodejs, leadership, react, scrum, teamwork","Worked as data_scientist for 16 years with expertise in javascript, nodejs, leadership",data_scientist,1
CAND_0317,9,associate,"linux, excel, statistics, agile, git, communication, sql, leadership","Worked as analyst for 9 years with expertise in linux, excel, statistics",analyst,1
CAND_0318,6,associate,"communication, linux, python, nodejs","Worked as consultant for 6 years with expertise in communication, linux, python",consultant,1
CAND_0319,10,bachelor,"azure, communication, machine learning, leadership, scrum, statistics","Worked as developer for 10 years with expertise in azure, communication, machine learning",developer,1
CAND_0320,1,associate,"azure, scrum, project management, react, communication, excel","Worked as fresher for 1 years with expertise in azure, scrum, project management",fresher,1
CAND_0321,11,associate,"nodejs, linux, git, leadership, teamwork, kubernetes","Worked as junior_developer for 11 years with expertise in nodejs, linux, git",junior_developer,1
CAND_0322,5,high_school,"javascript, nodejs","Worked as junior_developer for 5 years with expertise in javascript, nodejs",junior_developer,1
CAND_0323,6,high_school,"nodejs, git, java, scrum, machine learning, project management","Worked as junior_developer for 6 years with expertise in nodejs, git, java",junior_developer,1
CAND_0324,9,master,"git, azure, nodejs, communication","Worked as intern for 9 years with expertise in git, azure, nodejs",intern,1
CAND_0325,11,phd,"nodejs, kubernetes, react, scrum, java, excel, aws, leadership","Worked as designer for 11 years with expertise in nodejs, kubernetes, react",designer,1
CAND_0326,9,bachelor,"data analysis, linux, docker, nodejs, project management","Worked as junior_developer for 9 years with expertise in data analysis, linux, docker",junior_developer,1
CAND_0327,17,associate,"agile, statistics","Worked as senior_developer for 17 years with expertise in agile, statistics",senior_developer,0
CAND_0328,2,master,"communication, javascript, teamwork, data analysis, linux, project management, java, kubernetes","Worked as intern for 2 years with expertise in communication, javascript, teamwork",intern,1
CAND_0329,3,master,"aws, nodejs, data analysis, communication, docker, leadership, scrum, linux","Worked as senior_developer for 3 years with expertise in aws, nodejs, data analysis",senior_developer,0
CAND_0330,18,bachelor,"excel, statistics, git","Worked as consultant for 18 years with expertise in excel, statistics, git",consultant,1
CAND_0331,17,high_school,"python, statistics, communication","Worked as data_scientist for 17 years with expertise in python, statistics, communication",data_scientist,1
CAND_0332,5,phd,"aws, project management, react, sql, azure, scrum, javascript, docker","Worked as designer for 5 years with expertise in aws, project management, react",designer,1
CAND_0333,8,associate,"aws, python, machine learning, leadership, react, communication, scrum","Worked as analyst for 8 years with expertise in aws, python, machine learning",analyst,1
CAND_0334,13,phd,"docker, python, git","Worked as fresher for 13 years with expertise in docker, python, git",fresher,1
CAND_0335,9,master,"teamwork, statistics, docker, aws, javascript","Worked as developer for 9 years with expertise in teamwork, statistics, docker",developer,1
CAND_0336,4,bachelor,"docker, statistics, data analysis, nodejs","Worked as junior_developer for 4 years with expertise in docker, statistics, data analysis",junior_developer,1
CAND_0337,4,phd,"javascript, teamwork, machine learning, sql","Worked as developer for 4 years with expertise in javascript, teamwork, machine learning",developer,1
CAND_0338,8,master,"scrum, sql","Worked as fresher for 8 years with expertise in scrum, sql",fresher,1
CAND_0339,8,master,"nodejs, kubernetes","Worked as analyst for 8 years with expertise in nodejs, kubernetes",analyst,1
CAND_0340,10,high_school,"leadership, azure, statistics, excel, agile, react","Worked as designer for 10 years with expertise in leadership, azure, statistics",designer,1
CAND_0341,9,high_school,"aws, nodejs, sql","Worked as manager for 9 years with expertise in aws, nodejs, sql",manager,1
CAND_0342,9,bachelor,"linux, kubernetes, statistics, react, leadership, git, teamwork, python","Worked as data_scientist for 9 years with expertise in linux, kubernetes, statistics",data_scientist,1
CAND_0343,1,high_school,"docker, python, excel, agile, data analysis, nodejs, azure","Worked as senior_developer for 1 years with expertise in docker, python, excel",senior_developer,0
CAND_0344,5,master,"communication, agile","Worked as analyst for 5 years with expertise in communication, agile",analyst,1
CAND_0345,12,high_school,"javascript, excel, docker, azure","Worked as data_scientist for 12 years with expertise in javascript, excel, docker",data_scientist,1
CAND_0346,17,phd,"git, data analysis, kubernetes, scrum, docker, javascript, nodejs, react","Worked as analyst for 17 years with expertise in git, data analysis, kubernetes",analyst,1
CAND_0347,13,high_school,"data analysis, teamwork","Worked as developer for 13 years with expertise in data analysis, teamwork",developer,1
CAND_0348,2,phd,"aws, nodejs, teamwork, data analysis, docker","Worked as analyst for 2 years with expertise in aws, nodejs, teamwork",analyst,0
CAND_0349,19,high_school,"sql, communication","Worked as analyst for 19 years with expertise in sql, communication",analyst,1
CAND_0350,16,master,"java, python, project management, git, react, agile","Worked as fresher for 16 years with expertise in java, python, project management",fresher,1
CAND_0351,10,high_school,"communication, python, agile, project management, javascript","Worked as senior_developer for 10 years with expertise in communication, python, agile",senior_developer,1
CAND_0352,1,bachelor,"communication, aws, java, agile, python, docker","Worked as junior_developer for 1 years with expertise in communication, aws, java",junior_developer,1
CAND_0353,14,bachelor,"data analysis, aws, leadership, agile, python, project management","Worked as data_scientist for 14 years with expertise in data analysis, aws, leadership",data_scientist,1
CAND_0354,16,bachelor,"react, machine learning, leadership, scrum, statistics, communication, teamwork","Worked as analyst for 16 years with expertise in react, machine learning, leadership",analyst,1
CAND_0355,5,associate,"sql, azure, linux, leadership, docker, data analysis, javascript, java","Worked as junior_developer for 5 years with expertise in sql, azure, linux",junior_developer,1
CAND_0356,17,associate,"react, aws, statistics","Worked as junior_developer for 17 years with expertise in react, aws, statistics",junior_developer,0
CAND_0357,17,master,"python, statistics, teamwork","Worked as fresher for 17 years with expertise in python, statistics, teamwork",fresher,1
CAND_0358,8,bachelor,"statistics, python","Worked as analyst for 8 years with expertise in statistics, python",analyst,1
CAND_0359,15,associate,"sql, statistics, kubernetes, leadership, linux, git, project management","Worked as manager for 15 years with expertise in sql, statistics, kubernetes",manager,1
CAND_0360,11,phd,"azure, git, project management, teamwork, java","Worked as data_scientist for 11 years with expertise in azure, git, project management",data_scientist,1
CAND_0361,2,associate,"teamwork, sql, agile, leadership, machine learning, nodejs, docker, aws","Worked as senior_developer for 2 years with expertise in teamwork, sql, agile",senior_developer,0
CAND_0362,14,master,"project management, communication","Worked as developer for 14 years with expertise in project management, communication",developer,1
CAND_0363,14,associate,"scrum, statistics","Worked as intern for 14 years with expertise in scrum, statistics",intern,1
CAND_0364,2,phd,"machine learning, javascript, aws, linux, git, excel, java, teamwork","Worked as designer for 2 years with expertise in machine learning, javascript, aws",designer,1
CAND_0365,1,phd,"git, scrum, statistics, react, kubernetes, javascript, data analysis, azure","Worked as senior_developer for 1 years with expertise in git, scrum, statistics",senior_developer,0
CAND_0366,12,phd,"git, teamwork, leadership, linux","Worked as fresher for 12 years with expertise in git, teamwork, leadership",fresher,1
CAND_0367,16,associate,"project management, python, linux, excel, react, docker, java, sql","Worked as junior_developer for 16 years with expertise in project management, python, linux",junior_developer,1
CAND_0368,14,high_school,"git, docker, linux","Worked as senior_developer for 14 years with expertise in git, docker, linux",senior_developer,0
CAND_0369,19,bachelor,"excel, docker","Worked as fresher for 19 years with expertise in excel, docker",fresher,1
CAND_0370,11,associate,"docker, linux, scrum, statistics, teamwork, machine learning, excel, communication","Worked as analyst for 11 years with expertise in docker, linux, scrum",analyst,1
CAND_0371,16,master,"excel, kubernetes, azure","Worked as senior_developer for 16 years with expertise in excel, kubernetes, azure",senior_developer,1
CAND_0372,5,associate,"javascript, teamwork, communication, data analysis","Worked as designer for 5 years with expertise in javascript, teamwork, communication",designer,1
CAND_0373,6,high_school,"excel, aws, data analysis","Worked as senior_developer for 6 years with expertise in excel, aws, data analysis",senior_developer,0
CAND_0374,12,associate,"leadership, git, communication, nodejs, agile, teamwork, scrum, data analysis","Worked as senior_developer for 12 years with expertise in leadership, git, communication",senior_developer,1
CAND_0375,5,phd,"azure, aws, agile, communication, scrum, nodejs, kubernetes, docker","Worked as fresher for 5 years with expertise in azure, aws, agile",fresher,1
CAND_0376,0,bachelor,"communication, scrum, excel","Worked as data_scientist for 0 years with expertise in communication, scrum, excel",data_scientist,0
CAND_0377,1,phd,"nodejs, leadership, java, excel, scrum","Worked as designer for 1 years with expertise in nodejs, leadership, java",designer,1
CAND_0378,9,associate,"java, data analysis, nodejs, project management, sql, teamwork, git","Worked as data_scientist for 9 years with expertise in java, data analysis, nodejs",data_scientist,1
CAND_0379,1,associate,"leadership, aws, linux, statistics","Worked as fresher for 1 years with expertise in leadership, aws, linux",fresher,0
CAND_0380,5,bachelor,"javascript, communication","Worked as fresher for 5 years with expertise in javascript, communication",fresher,1
CAND_0381,8,associate,"scrum, machine learning, python, kubernetes, agile, communication, project management","Worked as analyst for 8 years with expertise in scrum, machine learning, python",analyst,1
CAND_0382,1,master,"docker, aws, kubernetes, nodejs","Worked as analyst for 1 years with expertise in docker, aws, kubernetes",analyst,0
CAND_0383,0,master,"project management, leadership, linux, teamwork","Worked as consultant for 0 years with expertise in project management, leadership, linux",consultant,0
CAND_0384,19,associate,"javascript, react, agile, machine learning, statistics, docker, azure","Worked as fresher for 19 years with expertise in javascript, react, agile",fresher,1
CAND_0385,18,master,"docker, java, excel, kubernetes, azure, communication","Worked as junior_developer for 18 years with expertise in docker, java, excel",junior_developer,1
CAND_0386,7,phd,"data analysis, excel, azure","Worked as developer for 7 years with expertise in data analysis, excel, azure",developer,1
CAND_0387,6,phd,"nodejs, java","Worked as fresher for 6 years with expertise in nodejs, java",fresher,1
CAND_0388,1,high_school,"python, nodejs","Worked as developer for 1 years with expertise in python, nodejs",developer,0
CAND_0389,4,phd,"react, machine learning, javascript","Worked as analyst for 4 years with expertise in react, machine learning, javascript",analyst,0
CAND_0390,9,master,"sql, project management, communication, nodejs, data analysis, scrum","Worked as developer for 9 years with expertise in sql, project management, communication",developer,1
CAND_0391,17,phd,"communication, project management, statistics, git, excel, docker, nodejs","Worked as data_scientist for 17 years with expertise in communication, project management, statistics",data_scientist,1
CAND_0392,5,associate,"react, sql, scrum, teamwork, project management, data analysis, javascript","Worked as analyst for 5 years with expertise in react, sql, scrum",analyst,1
CAND_0393,19,master,"nodejs, react, linux","Worked as consultant for 19 years with expertise in nodejs, react, linux",consultant,1
CAND_0394,10,high_school,"scrum, linux, excel, python","Worked as junior_developer for 10 years with expertise in scrum, linux, excel",junior_developer,1
CAND_0395,7,associate,"git, project management","Worked as consultant for 7 years with expertise in git, project management",consultant,1
CAND_0396,14,associate,"project management, java, agile, statistics, machine learning, teamwork, kubernetes","Worked as developer for 14 years with expertise in project management, java, agile",developer,1
CAND_0397,10,master,"excel, java, project management, python, docker, javascript","Worked as manager for 10 years with expertise in excel, java, project management",manager,1
CAND_0398,11,high_school,"kubernetes, linux, communication, javascript, sql, azure, react","Worked as fresher for 11 years with expertise in kubernetes, linux, communication",fresher,1
CAND_0399,12,bachelor,"agile, statistics","Worked as analyst for 12 years with expertise in agile, statistics",analyst,1
CAND_0400,13,high_school,"statistics, project management, machine learning, python, agile, azure, java, javascript","Worked as senior_developer for 13 years with expertise in statistics, project management, machine learning",senior_developer,1
CAND_0401,8,associate,"nodejs, excel, react, project management, git, statistics, kubernetes, leadership","Worked as intern for 8 years with expertise in nodejs, excel, react",intern,1
CAND_0402,10,high_school,"react, data analysis, python, excel, azure, docker, communication, java","Worked as consultant for 10 years with expertise in react, data analysis, python",consultant,1
CAND_0403,18,master,"aws, data analysis, machine learning, linux, java, leadership, javascript","Worked as developer for 18 years with expertise in aws, data analysis, machine learning",developer,1
CAND_0404,12,master,"aws, data analysis, scrum, project management, linux, git, communication","Worked as analyst for 12 years with expertise in aws, data analysis, scrum",analyst,1
CAND_0405,18,high_school,"sql, statistics, machine learning, data analysis, docker, nodejs, git","Worked as data_scientist for 18 years with expertise in sql, statistics, machine learning",data_scientist,1
CAND_0406,16,master,"excel, react, nodejs, aws, data analysis","Worked as senior_developer for 16 years with expertise in excel, react, nodejs",senior_developer,1
CAND_0407,8,bachelor,"react, javascript, linux, teamwork, kubernetes","Worked as intern for 8 years with expertise in react, javascript, linux",intern,1
CAND_0408,6,master,"linux, azure, python, statistics, kubernetes, java, excel, agile","Worked as consultant for 6 years with expertise in linux, azure, python",consultant,1
CAND_0409,16,high_school,"git, kubernetes, sql, python","Worked as analyst for 16 years with expertise in git, kubernetes, sql",analyst,1
CAND_0410,19,associate,"project management, linux, scrum, communication","Worked as intern for 19 years with expertise in project management, linux, scrum",intern,1
CAND_0411,18,high_school,"project management, agile, teamwork, javascript","Worked as consultant for 18 years with expertise in project management, agile, teamwork",consultant,1
CAND_0412,9,high_school,"statistics, git, leadership, nodejs, react, excel, linux, azure","Worked as manager for 9 years with expertise in statistics, git, leadership",manager,1
CAND_0413,6,associate,"leadership, aws, nodejs, python, linux, docker, javascript","Worked as data_scientist for 6 years with expertise in leadership, aws, nodejs",data_scientist,1
CAND_0414,6,bachelor,"scrum, git, data analysis, machine learning, javascript, agile, nodejs, azure","Worked as intern for 6 years with expertise in scrum, git, data analysis",intern,1
CAND_0415,13,associate,"linux, nodejs, teamwork, excel, javascript, docker, aws, agile","Worked as intern for 13 years with expertise in linux, nodejs, teamwork",intern,1
CAND_0416,10,associate,"excel, git, agile, leadership, sql","Worked as developer for 10 years with expertise in excel, git, agile",developer,1
CAND_0417,4,associate,"excel, teamwork, communication","Worked as designer for 4 years with expertise in excel, teamwork, communication",designer,1
CAND_0418,8,high_school,"git, docker","Worked as developer for 8 years with expertise in git, docker",developer,0
CAND_0419,16,master,"excel, teamwork, docker","Worked as designer for 16 years with expertise in excel, teamwork, docker",designer,1
CAND_0420,11,high_school,"data analysis, statistics, java, azure, communication","Worked as intern for 11 years with expertise in data analysis, statistics, java",intern,1
CAND_0421,16,phd,"project management, nodejs","Worked as manager for 16 years with expertise in project management, nodejs",manager,1
CAND_0422,0,master,"nodejs, excel, scrum, kubernetes","Worked as designer for 0 years with expertise in nodejs, excel, scrum",designer,0
CAND_0423,8,bachelor,"aws, docker, sql, teamwork, communication, data analysis, statistics","Worked as data_scientist for 8 years with expertise in aws, docker, sql",data_scientist,1
CAND_0424,16,master,"java, data analysis, agile, aws, nodejs, docker, statistics","Worked as senior_developer for 16 years with expertise in java, data analysis, agile",senior_developer,1
CAND_0425,19,associate,"git, data analysis, scrum, java","Worked as designer for 19 years with expertise in git, data analysis, scrum",designer,1
CAND_0426,17,high_school,"teamwork, react, project management, scrum, communication, data analysis","Worked as manager for 17 years with expertise in teamwork, react, project management",manager,1
CAND_0427,3,phd,"leadership, java, communication, machine learning","Worked as consultant for 3 years with expertise in leadership, java, communication",consultant,1
CAND_0428,11,high_school,"statistics, react","Worked as data_scientist for 11 years with expertise in statistics, react",data_scientist,0
CAND_0429,1,high_school,"react, teamwork, scrum, aws, agile, git, sql, leadership","Worked as manager for 1 years with expertise in react, teamwork, scrum",manager,0
CAND_0430,16,master,"docker, javascript, agile, react, teamwork, nodejs, aws, communication","Worked as junior_developer for 16 years with expertise in docker, javascript, agile",junior_developer,1
CAND_0431,17,master,"data analysis, project management, sql, nodejs, scrum","Worked as fresher for 17 years with expertise in data analysis, project management, sql",fresher,1
CAND_0432,18,high_school,"react, git, linux, scrum","Worked as data_scientist for 18 years with expertise in react, git, linux",data_scientist,0
CAND_0433,3,master,"java, aws, nodejs, project management, kubernetes, statistics, javascript, azure","Worked as manager for 3 years with expertise in java, aws, nodejs",manager,1
CAND_0434,11,bachelor,"statistics, project management","Worked as junior_developer for 11 years with expertise in statistics, project management",junior_developer,1
CAND_0435,16,master,"excel, aws, kubernetes, sql, docker, statistics","Worked as intern for 16 years with expertise in excel, aws, kubernetes",intern,1
CAND_0436,4,bachelor,"leadership, java, excel","Worked as analyst for 4 years with expertise in leadership, java, excel",analyst,0
CAND_0437,11,high_school,"project management, excel, aws, sql","Worked as consultant for 11 years with expertise in project management, excel, aws",consultant,1
CAND_0438,1,bachelor,"nodejs, excel, kubernetes, aws, communication, linux, sql","Worked as consultant for 1 years with expertise in nodejs, excel, kubernetes",consultant,1
CAND_0439,17,phd,"javascript, git, data analysis, java","Worked as data_scientist for 17 years with expertise in javascript, git, data analysis",data_scientist,1
CAND_0440,18,phd,"nodejs, data analysis, leadership","Worked as analyst for 18 years with expertise in nodejs, data analysis, leadership",analyst,1
CAND_0441,6,master,"java, linux, kubernetes, machine learning, aws, docker, sql, agile","Worked as manager for 6 years with expertise in java, linux, kubernetes",manager,1
CAND_0442,12,associate,"java, excel","Worked as designer for 12 years with expertise in java, excel",designer,1
CAND_0443,12,master,"teamwork, statistics, sql","Worked as data_scientist for 12 years with expertise in teamwork, statistics, sql",data_scientist,1
CAND_0444,7,master,"aws, project management","Worked as junior_developer for 7 years with expertise in aws, project management",junior_developer,1
CAND_0445,9,high_school,"excel, azure","Worked as designer for 9 years with expertise in excel, azure",designer,0
CAND_0446,6,high_school,"teamwork, sql, excel, statistics, data analysis, java, communication","Worked as analyst for 6 years with expertise in teamwork, sql, excel",analyst,1
CAND_0447,14,bachelor,"machine learning, java, nodejs, docker, communication, agile","Worked as data_scientist for 14 years with expertise in machine learning, java, nodejs",data_scientist,1
CAND_0448,4,high_school,"data analysis, agile, docker, sql, kubernetes, git","Worked as fresher for 4 years with expertise in data analysis, agile, docker",fresher,1
CAND_0449,6,phd,"communication, python","Worked as analyst for 6 years with expertise in communication, python",analyst,1
CAND_0450,2,phd,"statistics, linux, nodejs, azure, leadership, python, sql","Worked as data_scientist for 2 years with expertise in statistics, linux, nodejs",data_scientist,1
CAND_0451,7,bachelor,"machine learning, linux, javascript","Worked as consultant for 7 years with expertise in machine learning, linux, javascript",consultant,1
CAND_0452,8,bachelor,"linux, machine learning, nodejs","Worked as developer for 8 years with expertise in linux, machine learning, nodejs",developer,1
CAND_0453,15,high_school,"java, agile, communication, react","Worked as intern for 15 years with expertise in java, agile, communication",intern,1
CAND_0454,15,high_school,"git, scrum, nodejs, java, sql, communication, agile, machine learning","Worked as senior_developer for 15 years with expertise in git, scrum, nodejs",senior_developer,1
CAND_0455,11,master,"teamwork, java, docker, leadership","Worked as senior_developer for 11 years with expertise in teamwork, java, docker",senior_developer,1
CAND_0456,14,associate,"python, excel","Worked as data_scientist for 14 years with expertise in python, excel",data_scientist,1
CAND_0457,1,master,"scrum, python, aws, java, teamwork, communication, data analysis","Worked as senior_developer for 1 years with expertise in scrum, python, aws",senior_developer,0
CAND_0458,10,phd,"linux, project management","Worked as developer for 10 years with expertise in linux, project management",developer,1
CAND_0459,7,phd,"communication, git, docker, machine learning, leadership, data analysis, python","Worked as intern for 7 years with expertise in communication, git, docker",intern,1
CAND_0460,16,associate,"react, machine learning","Worked as junior_developer for 16 years with expertise in react, machine learning",junior_developer,1
CAND_0461,9,bachelor,"azure, statistics, react","Worked as designer for 9 years with expertise in azure, statistics, react",designer,1
CAND_0462,2,associate,"kubernetes, git, docker, excel, communication, teamwork, sql, react","Worked as junior_developer for 2 years with expertise in kubernetes, git, docker",junior_developer,1
CAND_0463,11,phd,"scrum, docker, leadership, aws","Worked as developer for 11 years with expertise in scrum, docker, leadership",developer,1
CAND_0464,1,bachelor,"azure, data analysis","Worked as analyst for 1 years with expertise in azure, data analysis",analyst,0
CAND_0465,5,associate,"machine learning, kubernetes, java, project management, git, scrum, agile","Worked as designer for 5 years with expertise in machine learning, kubernetes, java",designer,1
CAND_0466,3,associate,"machine learning, linux, git, excel, nodejs, python","Worked as fresher for 3 years with expertise in machine learning, linux, git",fresher,1
CAND_0467,10,high_school,"react, project management","Worked as designer for 10 years with expertise in react, project management",designer,1
CAND_0468,9,phd,"kubernetes, teamwork, linux","Worked as manager for 9 years with expertise in kubernetes, teamwork, linux",manager,1
CAND_0469,16,high_school,"java, react, docker, scrum, machine learning, kubernetes, azure, leadership","Worked as developer for 16 years with expertise in java, react, docker",developer,1
CAND_0470,10,bachelor,"excel, react, docker","Worked as consultant for 10 years with expertise in excel, react, docker",consultant,1
CAND_0471,2,high_school,"javascript, git, scrum, data analysis, react, nodejs","Worked as analyst for 2 years with expertise in javascript, git, scrum",analyst,0
CAND_0472,19,associate,"git, scrum, kubernetes","Worked as manager for 19 years with expertise in git, scrum, kubernetes",manager,0
CAND_0473,4,master,"python, communication, git","Worked as data_scientist for 4 years with expertise in python, communication, git",data_scientist,1
CAND_0474,19,master,"data analysis, teamwork, java","Worked as developer for 19 years with expertise in data analysis, teamwork, java",developer,1
