candidate_id,years_experience,education_level,skills,experience_description,position_applied,suitable
CAND_0001,6,master,"teamwork, kubernetes, leadership, excel, python, nodejs","Worked as junior_developer for 6 years with expertise in teamwork, kubernetes, leadership",junior_developer,1
CAND_0002,11,high_school,"git, react, communication, docker","Worked as developer for 11 years with expertise in git, react, communication",developer,1
CAND_0003,1,master,"python, linux, project management, teamwork, statistics","Worked as senior_developer for 1 years with expertise in python, linux, project management",senior_developer,0
CAND_0004,3,master,"java, data analysis, javascript, linux, sql, agile, kubernetes","Worked as intern for 3 years with expertise in java, data analysis, javascript",intern,1
CAND_0005,18,high_school,"docker, git, react, sql","Worked as junior_developer for 18 years with expertise in docker, git, react",junior_developer,1
CAND_0006,2,high_school,"java, agile, data analysis, excel, nodejs, communication","Worked as manager for 2 years with expertise in java, agile, data analysis",manager,0
CAND_0007,14,bachelor,"linux, javascript, communication, machine learning, teamwork, agile","Worked as designer for 14 years with expertise in linux, javascript, communication",designer,1
CAND_0008,19,phd,"azure, scrum, aws, java","Worked as intern for 19 years with expertise in azure, scrum, aws",intern,1
CAND_0009,1,bachelor,"nodejs, kubernetes, react, teamwork, docker, sql","Worked as developer for 1 years with expertise in nodejs, kubernetes, react",developer,0
CAND_0010,5,phd,"scrum, communication, kubernetes","Worked as designer for 5 years with expertise in scrum, communication, kubernetes",designer,1
CAND_0011,8,high_school,"kubernetes, aws, azure, statistics, machine learning, git, data analysis, docker","Worked as junior_developer for 8 years with expertise in kubernetes, aws, azure",junior_developer,1
CAND_0012,8,high_school,"leadership, docker, nodejs, project management","Worked as manager for 8 years with expertise in leadership, docker, nodejs",manager,1
CAND_0013,15,phd,"docker, statistics, java, leadership, machine learning","Worked as intern for 15 years with expertise in docker, statistics, java",intern,1
CAND_0014,1,phd,"teamwork, communication, java, project management, leadership","Worked as developer for 1 years with expertise in teamwork, communication, java",developer,0
CAND_0015,2,master,"machine learning, sql, aws, agile, nodejs","Worked as developer for 2 years with expertise in machine learning, sql, aws",developer,0
CAND_0016,6,phd,"machine learning, azure, teamwork, aws, agile, data analysis, react, kubernetes","Worked as fresher for 6 years with expertise in machine learning, azure, teamwork",fresher,1
CAND_0017,16,master,"git, leadership, azure, teamwork, java, excel, statistics","Worked as fresher for 16 years with expertise in git, leadership, azure",fresher,1
CAND_0018,18,high_school,"excel, azure, sql, javascript, docker, project management, leadership, react","Worked as junior_developer for 18 years with expertise in excel, azure, sql",junior_developer,1
CAND_0019,15,bachelor,"scrum, javascript, data analysis, react, teamwork, communication, java","Worked as consultant for 15 years with expertise in scrum, javascript, data analysis",consultant,1
CAND_0020,9,associate,"teamwork, agile, leadership","Worked as manager for 9 years with expertise in teamwork, agile, leadership",manager,1
CAND_0021,4,master,"statistics, linux","Worked as manager for 4 years with expertise in statistics, linux",manager,0
CAND_0022,1,bachelor,"linux, data analysis, java, nodejs, project management, python, javascript, communication","Worked as intern for 1 years with expertise in linux, data analysis, java",intern,1
CAND_0023,6,phd,"aws, machine learning, communication, java, project management, kubernetes, leadership, nodejs","Worked as developer for 6 years with expertise in aws, machine learning, communication",developer,1
CAND_0024,19,bachelor,"communication, python, agile, git, scrum, java, kubernetes, data analysis","Worked as fresher for 19 years with expertise in communication, python, agile",fresher,1
CAND_0025,10,bachelor,"react, scrum, python, sql, javascript, azure, aws, machine learning","Worked as analyst for 10 years with expertise in react, scrum, python",analyst,1
CAND_0026,19,high_school,"communication, kubernetes","Worked as senior_developer for 19 years with expertise in communication, kubernetes",senior_developer,1
CAND_0027,16,high_school,"azure, leadership","Worked as junior_developer for 16 years with expertise in azure, leadership",junior_developer,1
CAND_0028,16,high_school,"git, statistics, python, kubernetes, project management, teamwork, agile","Worked as consultant for 16 years with expertise in git, statistics, python",consultant,1
CAND_0029,3,bachelor,"leadership, sql, linux, react, project management, scrum, communication, nodejs","Worked as data_scientist for 3 years with expertise in leadership, sql, linux",data_scientist,1
CAND_0030,0,high_school,"linux, sql, communication, leadership, aws, statistics, azure, nodejs","Worked as analyst for 0 years with expertise in linux, sql, communication",analyst,0
CAND_0031,4,associate,"react, azure, leadership, machine learning","Worked as fresher for 4 years with expertise in react, azure, leadership",fresher,1
CAND_0032,2,bachelor,"excel, leadership, teamwork, docker, communication","Worked as analyst for 2 years with expertise in excel, leadership, teamwork",analyst,0
CAND_0033,14,bachelor,"azure, react, project management, kubernetes, statistics, nodejs, teamwork, excel","Worked as manager for 14 years with expertise in azure, react, project management",manager,1
CAND_0034,5,phd,"machine learning, leadership, java, teamwork, kubernetes, project management","Worked as analyst for 5 years with expertise in machine learning, leadership, java",analyst,1
CAND_0035,18,bachelor,"docker, sql, communication, excel, javascript, linux","Worked as consultant for 18 years with expertise in docker, sql, communication",consultant,1
CAND_0036,3,high_school,"sql, git","Worked as junior_developer for 3 years with expertise in sql, git",junior_developer,1
CAND_0037,5,bachelor,"communication, scrum, data analysis, git, react, java, excel, aws","Worked as manager for 5 years with expertise in communication, scrum, data analysis",manager,1
CAND_0038,14,high_school,"kubernetes, react, communication","Worked as manager for 14 years with expertise in kubernetes, react, communication",manager,1
CAND_0039,8,bachelor,"statistics, project management, agile, azure, teamwork, scrum, nodejs, leadership","Worked as manager for 8 years with expertise in statistics, project management, agile",manager,1
CAND_0040,12,master,"kubernetes, scrum, teamwork, communication, project management, java, docker","Worked as consultant for 12 years with expertise in kubernetes, scrum, teamwork",consultant,1
CAND_0041,11,associate,"azure, kubernetes, leadership","Worked as junior_developer for 11 years with expertise in azure, kubernetes, leadership",junior_developer,1
CAND_0042,10,high_school,"sql, project management, linux, azure, java","Worked as analyst for 10 years with expertise in sql, project management, linux",analyst,1
CAND_0043,9,high_school,"docker, react, sql, leadership, linux, nodejs, javascript, agile","Worked as analyst for 9 years with expertise in docker, react, sql",analyst,1
CAND_0044,9,master,"docker, excel, javascript, teamwork, aws","Worked as developer for 9 years with expertise in docker, excel, javascript",developer,1
CAND_0045,7,phd,"excel, python, project management, nodejs, javascript","Worked as designer for 7 years with expertise in excel, python, project management",designer,1
CAND_0046,7,associate,"linux, scrum","Worked as intern for 7 years with expertise in linux, scrum",intern,1
CAND_0047,13,high_school,"docker, azure, git, leadership","Worked as data_scientist for 13 years with expertise in docker, azure, git",data_scientist,1
CAND_0048,2,master,"agile, leadership, git","Worked as intern for 2 years with expertise in agile, leadership, git",intern,1
CAND_0049,10,associate,"git, java, sql, nodejs, kubernetes, machine learning","Worked as analyst for 10 years with expertise in git, java, sql",analyst,1
CAND_0050,15,bachelor,"react, nodejs","Worked as analyst for 15 years with expertise in react, nodejs",analyst,1
CAND_0051,0,master,"project management, react, kubernetes, agile, sql, leadership, teamwork, data analysis","Worked as analyst for 0 years with expertise in project management, react, kubernetes",analyst,0
CAND_0052,13,associate,"teamwork, nodejs, kubernetes","Worked as senior_developer for 13 years with expertise in teamwork, nodejs, kubernetes",senior_developer,1
CAND_0053,8,associate,"data analysis, scrum, sql, react, docker","Worked as consultant for 8 years with expertise in data analysis, scrum, sql",consultant,1
CAND_0054,12,associate,"nodejs, linux, kubernetes, javascript, communication, excel","Worked as senior_developer for 12 years with expertise in nodejs, linux, kubernetes",senior_developer,1
CAND_0055,5,bachelor,"communication, react, linux","Worked as junior_developer for 5 years with expertise in communication, react, linux",junior_developer,1
CAND_0056,7,bachelor,"teamwork, git","Worked as designer for 7 years with expertise in teamwork, git",designer,1
CAND_0057,8,associate,"kubernetes, scrum, data analysis, docker, aws, git","Worked as analyst for 8 years with expertise in kubernetes, scrum, data analysis",analyst,1
CAND_0058,11,bachelor,"statistics, sql, git, react, java, scrum","Worked as developer for 11 years with expertise in statistics, sql, git",developer,1
CAND_0059,8,phd,"python, docker, react, nodejs, sql, data analysis, excel, statistics","Worked as fresher for 8 years with expertise in python, docker, react",fresher,1
CAND_0060,9,high_school,"git, aws, linux, agile","Worked as junior_developer for 9 years with expertise in git, aws, linux",junior_developer,0
CAND_0061,15,phd,"agile, aws, data analysis, linux, azure","Worked as fresher for 15 years with expertise in agile, aws, data analysis",fresher,1
CAND_0062,6,master,"data analysis, react","Worked as consultant for 6 years with expertise in data analysis, react",consultant,1
CAND_0063,4,bachelor,"azure, excel, leadership, scrum, nodejs, aws, teamwork, python","Worked as data_scientist for 4 years with expertise in azure, excel, leadership",data_scientist,1
CAND_0064,5,phd,"scrum, project management, kubernetes, sql, linux, docker, nodejs","Worked as consultant for 5 years with expertise in scrum, project management, kubernetes",consultant,1
CAND_0065,1,bachelor,"kubernetes, docker, scrum, python","Worked as intern for 1 years with expertise in kubernetes, docker, scrum",intern,1
CAND_0066,5,phd,"azure, project management, kubernetes, machine learning, teamwork, nodejs","Worked as consultant for 5 years with expertise in azure, project management, kubernetes",consultant,1
CAND_0067,10,phd,"azure, python, kubernetes, communication, statistics, java","Worked as intern for 10 years with expertise in azure, python, kubernetes",intern,1
CAND_0068,11,associate,"python, aws","Worked as developer for 11 years with expertise in python, aws",developer,1
CAND_0069,16,master,"teamwork, azure","Worked as data_scientist for 16 years with expertise in teamwork, azure",data_scientist,1
CAND_0070,1,associate,"communication, scrum","Worked as designer for 1 years with expertise in communication, scrum",designer,1
CAND_0071,4,bachelor,"kubernetes, leadership, nodejs, statistics, project management, agile, scrum","Worked as designer for 4 years with expertise in kubernetes, leadership, nodejs",designer,1
CAND_0072,14,bachelor,"communication, git, java, docker, machine learning","Worked as analyst for 14 years with expertise in communication, git, java",analyst,1
CAND_0073,7,bachelor,"machine learning, leadership, java, agile, sql, project management","Worked as developer for 7 years with expertise in machine learning, leadership, java",developer,1
CAND_0074,14,master,"kubernetes, nodejs","Worked as designer for 14 years with expertise in kubernetes, nodejs",designer,1
CAND_0075,9,master,"python, machine learning, leadership, azure","Worked as developer for 9 years with expertise in python, machine learning, leadership",developer,1
CAND_0076,2,high_school,"excel, python, data analysis, teamwork, java, git, kubernetes","Worked as fresher for 2 years with expertise in excel, python, data analysis",fresher,1
CAND_0077,4,high_school,"linux, statistics, java, teamwork, data analysis","Worked as manager for 4 years with expertise in linux, statistics, java",manager,1
CAND_0078,18,high_school,"kubernetes, teamwork, python","Worked as designer for 18 years with expertise in kubernetes, teamwork, python",designer,1
CAND_0079,0,bachelor,"react, linux, scrum, javascript, statistics","Worked as fresher for 0 years with expertise in react, linux, scrum",fresher,1
CAND_0080,1,bachelor,"java, project management, statistics, linux, scrum, git","Worked as consultant for 1 years with expertise in java, project management, statistics",consultant,1
CAND_0081,19,master,"javascript, docker, project management, leadership","Worked as intern for 19 years with expertise in javascript, docker, project management",intern,1
CAND_0082,0,bachelor,"data analysis, aws, project management, git, javascript, linux","Worked as data_scientist for 0 years with expertise in data analysis, aws, project management",data_scientist,0
CAND_0083,5,master,"teamwork, sql, git, javascript, nodejs, kubernetes, statistics","Worked as senior_developer for 5 years with expertise in teamwork, sql, git",senior_developer,1
CAND_0084,17,associate,"git, react, azure","Worked as developer for 17 years with expertise in git, react, azure",developer,0
CAND_0085,5,high_school,"project management, scrum","Worked as developer for 5 years with expertise in project management, scrum",developer,0
CAND_0086,10,high_school,"docker, azure, agile, communication, java, data analysis, sql","Worked as junior_developer for 10 years with expertise in docker, azure, agile",junior_developer,1
CAND_0087,13,associate,"python, kubernetes, git, agile, statistics, linux, sql","Worked as analyst for 13 years with expertise in python, kubernetes, git",analyst,1
CAND_0088,13,associate,"nodejs, leadership, project management, python, agile, teamwork, docker, communication","Worked as consultant for 13 years with expertise in nodejs, leadership, project management",consultant,1
CAND_0089,2,associate,"javascript, teamwork, data analysis, linux, excel, git, machine learning","Worked as designer for 2 years with expertise in javascript, teamwork, data analysis",designer,1
CAND_0090,0,master,"linux, data analysis, project management, nodejs, sql, machine learning","Worked as junior_developer for 0 years with expertise in linux, data analysis, project management",junior_developer,1
CAND_0091,6,associate,"communication, docker, linux","Worked as intern for 6 years with expertise in communication, docker, linux",intern,1
CAND_0092,10,associate,"react, azure, machine learning, statistics, nodejs, agile, aws","Worked as intern for 10 years with expertise in react, azure, machine learning",intern,1
CAND_0093,6,phd,"azure, scrum, aws, docker, leadership, kubernetes","Worked as designer for 6 years with expertise in azure, scrum, aws",designer,1
CAND_0094,2,associate,"azure, scrum, git, aws, linux","Worked as senior_developer for 2 years with expertise in azure, scrum, git",senior_developer,0
CAND_0095,12,master,"docker, kubernetes, javascript, git, teamwork, leadership, react","Worked as manager for 12 years with expertise in docker, kubernetes, javascript",manager,1
CAND_0096,12,associate,"statistics, docker, leadership, aws, linux, communication","Worked as intern for 12 years with expertise in statistics, docker, leadership",intern,1
CAND_0097,12,bachelor,"git, python, agile","Worked as junior_developer for 12 years with expertise in git, python, agile",junior_developer,1
CAND_0098,1,high_school,"project management, react","Worked as data_scientist for 1 years with expertise in project management, react",data_scientist,0
CAND_0099,12,master,"sql, excel, nodejs","Worked as designer for 12 years with expertise in sql, excel, nodejs",designer,1
CAND_0100,18,master,"teamwork, python, react, javascript, linux","Worked as developer for 18 years with expertise in teamwork, python, react",developer,1
CAND_0101,13,phd,"communication, linux, javascript, git, sql, agile","Worked as data_scientist for 13 years with expertise in communication, linux, javascript",data_scientist,1
CAND_0102,10,phd,"kubernetes, git, linux, react, nodejs, project management, agile, aws","Worked as designer for 10 years with expertise in kubernetes, git, linux",designer,1
CAND_0103,15,phd,"leadership, git, data analysis","Worked as developer for 15 years with expertise in leadership, git, data analysis",developer,1
CAND_0104,10,high_school,"python, aws, azure, git","Worked as manager for 10 years with expertise in python, aws, azure",manager,1
CAND_0105,15,master,"docker, machine learning, agile, azure, statistics, git, leadership, data analysis","Worked as developer for 15 years with expertise in docker, machine learning, agile",developer,1
CAND_0106,1,phd,"machine learning, linux, javascript, python, kubernetes, sql, data analysis, scrum","Worked as consultant for 1 years with expertise in machine learning, linux, javascript",consultant,1
CAND_0107,16,phd,"leadership, java, scrum","Worked as manager for 16 years with expertise in leadership, java, scrum",manager,1
CAND_0108,1,phd,"teamwork, java, statistics, excel, sql, kubernetes, project management, leadership","Worked as consultant for 1 years with expertise in teamwork, java, statistics",consultant,1
CAND_0109,4,associate,"data analysis, excel","Worked as fresher for 4 years with expertise in data analysis, excel",fresher,1
CAND_0110,19,master,"docker, leadership, python","Worked as data_scientist for 19 years with expertise in docker, leadership, python",data_scientist,1
CAND_0111,19,associate,"azure, java, agile, git, excel, statistics, react","Worked as junior_developer for 19 years with expertise in azure, java, agile",junior_developer,1
CAND_0112,19,master,"react, python, excel, statistics, teamwork, azure, sql","Worked as junior_developer for 19 years with expertise in react, python, excel",junior_developer,1
CAND_0113,16,high_school,"leadership, javascript, communication, nodejs, scrum, azure, machine learning, java","Worked as analyst for 16 years with expertise in leadership, javascript, communication",analyst,1
CAND_0114,2,phd,"teamwork, scrum, linux, project management, aws, communication, java","Worked as developer for 2 years with expertise in teamwork, scrum, linux",developer,0
CAND_0115,6,associate,"linux, python","Worked as manager for 6 years with expertise in linux, python",manager,1
CAND_0116,9,high_school,"nodejs, azure, aws, kubernetes, javascript","Worked as data_scientist for 9 years with expertise in nodejs, azure, aws",data_scientist,1
CAND_0117,6,phd,"aws, java, azure","Worked as fresher for 6 years with expertise in aws, java, azure",fresher,1
CAND_0118,3,associate,"communication, javascript, sql, azure, leadership, machine learning, linux, docker","Worked as intern for 3 years with expertise in communication, javascript, sql",intern,1
CAND_0119,1,associate,"kubernetes, docker, java, linux","Worked as analyst for 1 years with expertise in kubernetes, docker, java",analyst,0
CAND_0120,13,bachelor,"azure, react, machine learning","Worked as intern for 13 years with expertise in azure, react, machine learning",intern,1
CAND_0121,11,associate,"react, python, scrum, nodejs, azure","Worked as junior_developer for 11 years with expertise in react, python, scrum",junior_developer,1
CAND_0122,7,high_school,"nodejs, agile, git, java, docker, excel, scrum, leadership","Worked as developer for 7 years with expertise in nodejs, agile, git",developer,1
CAND_0123,3,master,"agile, kubernetes, project management","Worked as data_scientist for 3 years with expertise in agile, kubernetes, project management",data_scientist,1
CAND_0124,14,master,"react, linux, docker, git, machine learning, scrum","Worked as intern for 14 years with expertise in react, linux, docker",intern,1
CAND_0125,14,bachelor,"machine learning, docker","Worked as manager for 14 years with expertise in machine learning, docker",manager,1
CAND_0126,5,phd,"git, scrum","Worked as manager for 5 years with expertise in git, scrum",manager,1
CAND_0127,13,master,"scrum, statistics, docker, machine learning, sql, python, nodejs","Worked as consultant for 13 years with expertise in scrum, statistics, docker",consultant,1
CAND_0128,13,high_school,"leadership, java","Worked as senior_developer for 13 years with expertise in leadership, java",senior_developer,1
CAND_0129,8,master,"data analysis, leadership, agile, aws, sql","Worked as designer for 8 years with expertise in data analysis, leadership, agile",designer,1
CAND_0130,0,phd,"git, kubernetes, aws, leadership, react, machine learning","Worked as intern for 0 years with expertise in git, kubernetes, aws",intern,1
CAND_0131,18,master,"excel, git, machine learning, aws, kubernetes, scrum, leadership, data analysis","Worked as senior_developer for 18 years with expertise in excel, git, machine learning",senior_developer,1
CAND_0132,11,associate,"machine learning, java, project management, azure","Worked as junior_developer for 11 years with expertise in machine learning, java, project management",junior_developer,1
CAND_0133,6,phd,"sql, kubernetes","Worked as consultant for 6 years with expertise in sql, kubernetes",consultant,1
CAND_0134,12,phd,"java, teamwork, sql, agile, react","Worked as developer for 12 years with expertise in java, teamwork, sql",developer,1
CAND_0135,14,master,"kubernetes, teamwork, data analysis","Worked as analyst for 14 years with expertise in kubernetes, teamwork, data analysis",analyst,1
CAND_0136,18,bachelor,"linux, statistics, aws, azure, sql, nodejs, leadership","Worked as fresher for 18 years with expertise in linux, statistics, aws",fresher,1
CAND_0137,12,associate,"azure, linux, nodejs, communication, python, aws","Worked as consultant for 12 years with expertise in azure, linux, nodejs",consultant,1
CAND_0138,10,associate,"kubernetes, nodejs, aws, teamwork, data analysis, agile, leadership","Worked as intern for 10 years with expertise in kubernetes, nodejs, aws",intern,1
CAND_0139,16,phd,"excel, react, aws","Worked as junior_developer for 16 years with expertise in excel, react, aws",junior_developer,1
CAND_0140,18,associate,"communication, react, agile, azure","Worked as data_scientist for 18 years with expertise in communication, react, agile",data_scientist,1
CAND_0141,16,phd,"aws, nodejs, sql, python, linux","Worked as data_scientist for 16 years with expertise in aws, nodejs, sql",data_scientist,1
CAND_0142,11,phd,"teamwork, scrum, machine learning, project management, azure","Worked as senior_developer for 11 years with expertise in teamwork, scrum, machine learning",senior_developer,1
CAND_0143,7,master,"javascript, azure","Worked as consultant for 7 years with expertise in javascript, azure",consultant,1
CAND_0144,18,bachelor,"docker, git, scrum, aws, machine learning","Worked as fresher for 18 years with expertise in docker, git, scrum",fresher,1
CAND_0145,18,master,"kubernetes, java, sql, leadership, scrum, react","Worked as senior_developer for 18 years with expertise in kubernetes, java, sql",senior_developer,1
CAND_0146,17,phd,"project management, machine learning, sql, data analysis","Worked as data_scientist for 17 years with expertise in project management, machine learning, sql",data_scientist,1
CAND_0147,0,phd,"aws, azure, kubernetes, statistics, machine learning, docker","Worked as junior_developer for 0 years with expertise in aws, azure, kubernetes",junior_developer,0
CAND_0148,18,bachelor,"sql, machine learning, python","Worked as data_scientist for 18 years with expertise in sql, machine learning, python",data_scientist,1
CAND_0149,6,high_school,"python, teamwork","Worked as developer for 6 years with expertise in python, teamwork",developer,0
CAND_0150,3,phd,"machine learning, sql, docker","Worked as senior_developer for 3 years with expertise in machine learning, sql, docker",senior_developer,0
CAND_0151,8,phd,"scrum, project management, docker, leadership, machine learning, linux","Worked as intern for 8 years with expertise in scrum, project management, docker",intern,1
CAND_0152,0,master,"data analysis, excel, java, git, azure, project management, javascript, statistics","Worked as intern for 0 years with expertise in data analysis, excel, java",intern,1
CAND_0153,4,master,"react, data analysis, leadership, docker","Worked as intern for 4 years with expertise in react, data analysis, leadership",intern,1
CAND_0154,3,phd,"azure, scrum, aws, leadership, react, agile","Worked as senior_developer for 3 years with expertise in azure, scrum, aws",senior_developer,0
CAND_0155,12,high_school,"git, project management, teamwork, azure, scrum, javascript, linux","Worked as developer for 12 years with expertise in git, project management, teamwork",developer,1
CAND_0156,16,master,"project management, statistics, teamwork, agile, scrum","Worked as data_scientist for 16 years with expertise in project management, statistics, teamwork",data_scientist,1
CAND_0157,6,phd,"data analysis, statistics","Worked as intern for 6 years with expertise in data analysis, statistics",intern,1
CAND_0158,7,bachelor,"data analysis, kubernetes, react, scrum, python, azure","Worked as intern for 7 years with expertise in data analysis, kubernetes, react",intern,1
